{
  "name": "Catppuccin Mocha",
  "author": "catppuccin",
  "variant": "dark",
  "paired": "catppuccin-latte",
  "colors": {
    "base00": "#1e1e2e",
    "base01": "#313244",
    "base02": "#45475a",
    "base03": "#585b70",
    "base04": "#a6adc8",
    "base05": "#cdd6f4",
    "base06": "#f5e0dc",
    "base07": "#ffffff",
    "base08": "#f38ba8",
    "base09": "#fab387",
    "base0A": "#f9e2af",
    "base0B": "#a6e3a1",
    "base0C": "#94e2d5",
    "base0D": "#89b4fa",
    "base0E": "#cba6f7",
    "base0F": "#f2cdcd"
  },
  "semantic": {
    "background": "base00",
    "backgroundAlt": "base01",
    "backgroundHighlight": "base02",
    "foreground": "base05",
    "foregroundAlt": "base04",
    "foregroundHighlight": "base06",
    "foregroundInactive": "base03",
    "border": "base02",
    "borderFocus": "base0D",
    "accent": "base0D",
    "accentAlt": "base0E",
    "success": "base0B",
    "warning": "base0A",
    "error": "base08",
    "info": "base0C",
    "red": "base08",
    "green": "base0B",
    "yellow": "base0A",
    "blue": "base0D",
    "magenta": "base0E",
    "cyan": "base0C",
    "white": "base05"
  }
}
