{
  "name": "Tokyo Night",
  "author": "enkia",
  "variant": "dark",
  "paired": "tokyo-day",
  "colors": {
    "base00": "#1a1b26",
    "base01": "#292e42",
    "base02": "#414868",
    "base03": "#565f89",
    "base04": "#a9b1d6",
    "base05": "#c0caf5",
    "base06": "#d5d6db",
    "base07": "#ffffff",
    "base08": "#f7768e",
    "base09": "#ff9e64",
    "base0A": "#e0af68",
    "base0B": "#9ece6a",
    "base0C": "#7dcfff",
    "base0D": "#7aa2f7",
    "base0E": "#bb9af7",
    "base0F": "#73daca"
  },
  "semantic": {
    "background": "base00",
    "backgroundAlt": "base01",
    "backgroundHighlight": "base02",
    "foreground": "base05",
    "foregroundAlt": "base04",
    "foregroundHighlight": "base06",
    "foregroundInactive": "base03",
    "border": "base02",
    "borderFocus": "base0D",
    "accent": "base0D",
    "accentAlt": "base0E",
    "success": "base0B",
    "warning": "base0A",
    "error": "base08",
    "info": "base0C",
    "red": "base08",
    "green": "base0B",
    "yellow": "base0A",
    "blue": "base0D",
    "magenta": "base0E",
    "cyan": "base0C",
    "white": "base05",
    "bg0": "base00",
    "bg1": "base01",
    "bg2": "base02",
    "fg3": "base03",
    "fg2": "base04",
    "fg1": "base05"
  }
}
