{
  "name": "Tokyo Day",
  "author": "enkia",
  "variant": "light",
  "paired": "tokyo-night",
  "colors": {
    "base00": "#d5d6db",
    "base01": "#e9e9ec",
    "base02": "#868a9a",
    "base03": "#9699a3",
    "base04": "#565a6e",
    "base05": "#3e414f",
    "base06": "#2e3039",
    "base07": "#0f0f14",
    "base08": "#8c4351",
    "base09": "#965027",
    "base0A": "#8f6f3b",
    "base0B": "#567a48",
    "base0C": "#2d6d85",
    "base0D": "#345a8a",
    "base0E": "#6a467f",
    "base0F": "#b15c00"
  },
  "semantic": {
    "background": "base00",
    "backgroundAlt": "base01",
    "backgroundHighlight": "base01",
    "foreground": "base05",
    "foregroundAlt": "base04",
    "foregroundHighlight": "base06",
    "foregroundInactive": "base03",
    "border": "base02",
    "borderFocus": "base0D",
    "accent": "base0D",
    "accentAlt": "base0E",
    "success": "base0B",
    "warning": "base0A",
    "error": "base08",
    "info": "base0C",
    "red": "base08",
    "green": "base0B",
    "yellow": "base0A",
    "blue": "base0D",
    "magenta": "base0E",
    "cyan": "base0C",
    "white": "base05",
    "bg0": "base00",
    "bg1": "base01",
    "bg2": "base02",
    "bg3": "base03",
    "fg3": "base04",
    "fg2": "base05",
    "fg1": "base06"
  }
}
