{
  "name": "Solarized Dark",
  "author": "Ethan Schoonover",
  "variant": "dark",
  "paired": "solarized-light",
  "colors": {
    "base00": "#002b36",
    "base01": "#073642",
    "base02": "#586e75",
    "base03": "#657b83",
    "base04": "#839496",
    "base05": "#93a1a1",
    "base06": "#eee8d5",
    "base07": "#fdf6e3",
    "base08": "#dc322f",
    "base09": "#cb4b16",
    "base0A": "#b58900",
    "base0B": "#859900",
    "base0C": "#2aa198",
    "base0D": "#268bd2",
    "base0E": "#d33682",
    "base0F": "#6c71c4"
  },
  "semantic": {
    "background": "base00",
    "backgroundAlt": "base01",
    "backgroundHighlight": "base01",
    "foreground": "base05",
    "foregroundAlt": "base04",
    "foregroundHighlight": "base06",
    "foregroundInactive": "base03",
    "border": "base02",
    "borderFocus": "base0D",
    "accent": "base0D",
    "accentAlt": "base0C",
    "success": "base0B",
    "warning": "base0A",
    "error": "base08",
    "info": "base0C",
    "red": "base08",
    "green": "base0B",
    "yellow": "base0A",
    "blue": "base0D",
    "magenta": "base0E",
    "cyan": "base0C",
    "white": "base05",
    "bg0": "base00",
    "bg1": "base01",
    "bg2": "base02",
    "bg3": "base03",
    "fg3": "base04",
    "fg2": "base05",
    "fg1": "base06"
  }
}
